{
  "schemaVersion": "1.0.0",
  "version": "1.0.0",
  "id": "INV-CORE-007",
  "domain": "CORE",
  "lifecycle": "supported",
  "severity": "constitutional",
  "type": "audit",
  "title": "Evidence is hash-chained, append-only, attributed, and never edited",
  "statement": "Every evidence record MUST be appended by the executing verb, attributed to that verb, content-hashed and predecessor-linked into the chain with exact tree, inputs, and outcomes, MUST never be edited in place, and a chain with a sequence gap or a broken digest link MUST fail verification rather than resolve its intact prefix.",
  "rationale": "Article 41 and Article 6 (record/ is machine only) make evidence trustworthy only because it cannot be rewritten; ADR-GOV-0012 and ADR-GOV-0013 apply the same rule to release records.",
  "status": "active",
  "verification": {
    "required_suites": ["unit", "int"],
    "oracle": "tests",
    "strategy": {
      "primary": "regression",
      "deterministic_check_available": true,
      "rationale": "A deterministic test corpus under tests/ and packages/*/tests observes this obligation; trace links the tests."
    }
  },
  "authority_docs": {
    "docs": [
      {
        "doc": "law/constitution.md",
        "anchor": "article-41-evidence"
      },
      {
        "doc": "law/constitution.md",
        "anchor": "article-6-substrate-authority-by-path"
      },
      {
        "doc": "law/adr/ADR-GOV-0012-release-execution-seams.md",
        "anchor": "decision"
      },
      {
        "doc": "law/adr/ADR-GOV-0013-executable-release-lifecycle-contract.md",
        "anchor": "decision"
      },
      {
        "doc": "law/adr/ADR-REL-0022-signed-portable-export-closure.md",
        "anchor": "decision"
      }
    ],
    "decisions": ["ADR-GOV-0012", "ADR-GOV-0013", "ADR-REL-0022", "ADR-GOV-0027", "ADR-EVI-0007"]
  },
  "scope": {
    "components": ["evidence", "proof-chain", "round-seal"],
    "code_areas": [
      "packages/evidence/src/**",
      "packages/cli/src/commands/evidence/**",
      "packages/cli/src/commands/record/**",
      "packages/cli/src/commands/sense/bootstrap-inventory.ts",
      "packages/authority/src/boundaries/reconciliation-*.ts"
    ]
  },
  "change_policy": {
    "breaking_change_requires": [
      "doc_update",
      "trace_update",
      "test_update",
      "human_approval",
      "adr"
    ],
    "test_weakening_allowed": false,
    "human_approval_required": true
  },
  "tags": ["evidence", "hash-chain", "append-only", "article-41", "article-6"],
  "measurable_via": [
    "evidence record",
    "evidence verify",
    "round seal",
    "evidence reconcile plan",
    "evidence reconcile approve",
    "evidence reconcile materialize",
    "evidence reconcile stage-proof",
    "sense bootstrap-inventory"
  ],
  "provenance": ["ADR-SCR-0004", "CMP-0002:R-0203:TASK-0231"],
  "supersedes": null,
  "superseded_by": null
}
