{
  "schemaVersion": "1.0.0",
  "version": "1.0.0",
  "id": "INV-DEVAI-001",
  "domain": "DEVAI",
  "lifecycle": "supported",
  "severity": "constitutional",
  "type": "governance",
  "title": "Every invariant record is a schema-valid setpoint citing its authority",
  "statement": "Every record under law/invariants/ MUST validate against law/schemas/invariant.schema.json, MUST carry a unique id of the form INV-<DOMAIN>-<NNN> whose domain is declared in the domain taxonomy, a severity from the declared vocabulary, a single canonical statement, and at least one authority anchor that resolves to a heading in a constitution article or an accepted decision record.",
  "rationale": "Article 11 makes the invariant the atomic spec unit; ADR-SCR-0004 requires the framework to carry its own records and cite their sources.",
  "status": "active",
  "verification": {
    "required_suites": ["unit", "int"],
    "oracle": "tests",
    "strategy": {
      "primary": "regression",
      "deterministic_check_available": true,
      "rationale": "A deterministic test corpus under tests/ and packages/*/tests observes this obligation; trace links the tests."
    }
  },
  "authority_docs": {
    "docs": [
      {
        "doc": "law/constitution.md",
        "anchor": "article-11-invariant-as-atomic-spec-unit"
      },
      {
        "doc": "law/constitution.md",
        "anchor": "article-14-per-invariant-change-policy"
      },
      {
        "doc": "law/adr/ADR-SCR-0004-framework-specification-substrate.md",
        "anchor": "decision"
      }
    ],
    "decisions": ["ADR-SCR-0004"]
  },
  "scope": {
    "components": ["spec-validation", "invariant-records"],
    "code_areas": ["packages/spec/src/spec/**", "packages/cli/src/commands/spec/**"]
  },
  "change_policy": {
    "breaking_change_requires": [
      "doc_update",
      "trace_update",
      "test_update",
      "human_approval",
      "adr"
    ],
    "test_weakening_allowed": false,
    "human_approval_required": true
  },
  "tags": ["invariants", "schema", "citation", "article-11", "article-14"],
  "measurable_via": ["check"],
  "provenance": ["ADR-SCR-0004", "CMP-0002:R-0203:TASK-0231"],
  "supersedes": null,
  "superseded_by": null
}
