{
  "schemaVersion": "1.0.0",
  "version": "1.0.0",
  "id": "INV-CORE-009",
  "domain": "CORE",
  "lifecycle": "supported",
  "severity": "constitutional",
  "type": "lifecycle",
  "title": "Cross-authority work runs as coupled triplets in pipeline order",
  "statement": "Work that spans the authority chain MUST be grouped as an Architect task, an Inspector task, and an Engineer task sharing one coupled task group, each downstream branch MUST be created from the upstream head, and merges MUST follow the authority order Architect, Inspector, Engineer with downstream rebase after each upstream merge.",
  "rationale": "Article 24 turns the authority chain into a branch pipeline so that no discipline sets its own reference and actuates against it.",
  "status": "active",
  "verification": {
    "required_suites": ["unit", "int"],
    "oracle": "tests",
    "strategy": {
      "primary": "regression",
      "deterministic_check_available": true,
      "rationale": "A deterministic test corpus under tests/ and packages/*/tests observes this obligation; trace links the tests."
    }
  },
  "authority_docs": {
    "docs": [
      {
        "doc": "law/constitution.md",
        "anchor": "article-24-coupled-task-triplets"
      },
      {
        "doc": "law/constitution.md",
        "anchor": "article-26-checkpoints-and-pipelined-rebase"
      }
    ]
  },
  "scope": {
    "components": ["task-lifecycle", "round-lifecycle"],
    "code_areas": [
      "packages/loop/src/round-lifecycle/**",
      "packages/cli/src/commands/round/**",
      "packages/cli/src/commands/task/**"
    ]
  },
  "change_policy": {
    "breaking_change_requires": [
      "doc_update",
      "trace_update",
      "test_update",
      "human_approval",
      "adr"
    ],
    "test_weakening_allowed": false,
    "human_approval_required": true
  },
  "tags": ["coupled-triplet", "pipeline", "merge-order", "article-24", "article-26"],
  "measurable_via": ["round plan", "round run", "round assess", "round close", "round dispatch"],
  "provenance": ["ADR-SCR-0004", "CMP-0002:R-0203:TASK-0231"],
  "supersedes": null,
  "superseded_by": null
}
