{
  "schemaVersion": "1.0.0",
  "version": "1.2.0",
  "id": "INV-HARNESS-009",
  "domain": "HARNESS",
  "lifecycle": "supported",
  "severity": "hard-fail",
  "type": "governance",
  "title": "Recipes are host-invoked contracts bounded by their declared variant",
  "statement": "Every recipe MUST have one canonical source whose manifest validates and whose SKILL.md front matter matches it, its host projections MUST be byte copies of that source, an installation MUST refuse as a whole before its first write when a preflight over every target finds a symlink on any installation path or any drifted target, MUST hold the exclusive repository recipe-install lock (created without replacing an existing lock, removed only by its owner, and refused rather than taken over when stale) from its write-time recheck through every publication and any rollback, MUST recheck every target and its ancestors at write time without following links and refuse when one has become a symlink or differs from its preflight observation, MUST refuse when a file it published does not resolve, with its parent, inside the repository as the identity its publication returned, and make one attempt to remove that file through the governed identity-bound removal, which the authority broker admits for the target it authorized for that publication, reporting the file as escaped residue unless that attempt removed it, and MUST install as one unit that publishes each new file without replacing an existing entry and, on any refusal or failure, removes through that identity-bound removal every file it published (by the identity its publication returned) and every directory it created (by the identity pinned at its creation) that is still that identity and holds no other entry, putting any other entry found at those paths back without replacing an entry that took the path meanwhile, and leaving and reporting as residue any directory it created but could not pin, so the prior set of targets remains, and every typed operation MUST run only as part of a manifest-declared variant of a known recipe, with an effect no wider than the variant, explicit repository-relative write paths inside the variant write scope for any non-read operation, and an existing materialized file with different bytes reported as drift rather than overwritten.",
  "rationale": "ADR-GOV-0020 keeps one canonical recipe source with generated projections, and the recipe contract keeps deterministic work in typed operations whose effects and write scopes the declared variant bounds; a recipe that widens its scope would act outside any authorized boundary. The symlink and drift refusal runs twice: a preflight over every target, and a write-time recheck by lstat and no-follow reads against the preflight digests, so a target changed or a link inserted after preflight refuses; the ADR-AUT-0005 no-replace publication, which returns the identity of the file it created, a no-follow descriptor that pins each published inode until the installation ends so the identity cannot be reused, and an in-process rollback journal keep a failed installation from leaving a partial set (issue #313). Threat model: the lock excludes concurrent DEVAI installers, and the post-publication realpath and identity check detects an escape after the fact. Node offers no openat, so the checks are path based: a hostile local process that swaps an ancestor for a link between the recheck and the link(2) can make one write land outside the repository before it is detected, unlinked and refused; preventing that window is outside this statement. Issue #317 closed the cleanup races of that family: an identity-bound removal renames the entry to a fresh private quarantine name before it checks the identity, so an entry swapped in at the public path is put back and never removed, and the broker classifies the removal of a file this invocation published by the target it authorized for that publication. An entry put back never replaces one that took its path: a file is hard-linked back, a link is recreated, and a directory claims the path with an empty placeholder before it is renamed over it; an occupied path keeps the entry in quarantine and refuses with AUTHORITY_REMOVE_RESTORE_INCOMPLETE. An identity-bound removal that no publication of the invocation is bound to pins its parent with a no-follow directory descriptor and re-verifies the parent's realpath and identity immediately before and after the effect, refusing with AUTHORITY_REMOVE_PARENT_ESCAPED. Residual limits: a process that finds the random quarantine name and replaces that entry between the rename and the identity check can still have its entry checked (it is removed only if it carries the identity); an entry put back is absent from its path while the removal runs; a process that swaps the directory placeholder for its own empty directory in the instant before the rename has that empty directory replaced; Node has no directory-relative rename, so an ancestor swapped and swapped back between the parent checks around an unpublished removal is not seen; and a directory another process creates or swaps in at a path between the installer's absence check and the pin after its mkdir is taken for the installer's own, because the broker reports a mkdir of an existing directory as success. A process crash mid-installation is also outside it: it can leave a subset of the new files and the lock, which then refuses as stale until a human removes it, after which a re-run completes the set because files holding the generated bytes are left unchanged.",
  "status": "active",
  "verification": {
    "required_suites": ["unit"],
    "oracle": "tests",
    "strategy": {
      "primary": "regression",
      "deterministic_check_available": true,
      "rationale": "A deterministic test corpus under tests/ and packages/*/tests observes this obligation; trace links the tests."
    }
  },
  "authority_docs": {
    "docs": [
      {
        "doc": "law/adr/ADR-GOV-0020-canonical-instructions-and-host-projections.md",
        "anchor": "decision"
      },
      {
        "doc": "law/constitution.md",
        "anchor": "article-36-devai-evaluates-the-configured-repository-substrate"
      }
    ]
  },
  "scope": {
    "components": ["recipes", "operations"],
    "code_areas": [
      "packages/skills/src/recipes/**",
      "packages/skills/src/operations/catalog.ts",
      "packages/skills/src/operations/host.ts",
      "packages/skills/src/operations/materialize.ts",
      "packages/skills/src/operations/types.ts",
      "packages/skills/src/operations/index.ts"
    ]
  },
  "change_policy": {
    "breaking_change_requires": ["doc_update", "trace_update", "test_update", "adr"],
    "test_weakening_allowed": false,
    "human_approval_required": false
  },
  "tags": ["recipes", "operations", "write-scope"],
  "measurable_via": ["init apply harness", "check"],
  "provenance": ["ADR-GOV-0020", "ADR-AUT-0005", "issue #295", "issue #313", "issue #317"],
  "supersedes": null,
  "superseded_by": null
}
